"No.","Time","Delta","TCP Stream Time","Source","Destination","Protocol","Length","Info"
"1","2022-11-20 19:53:04.995614994","0.000000000","0.000000000","192.168.1.157","34.120.127.120","TLSv1.2","93","Application Data"
"2","2022-11-20 19:53:04.996093245","0.000478251","0.000478251","34.120.127.120","192.168.1.157","TCP","60","https(443)  >  49422 [ACK] Seq=1 Ack=40 Win=64240 Len=0"
"3","2022-11-20 19:53:05.009788149","0.013694904","0.013694904","34.120.127.120","192.168.1.157","TLSv1.2","93","Application Data"
"4","2022-11-20 19:53:05.052562656","0.042774507","0.042774507","192.168.1.157","34.120.127.120","TCP","54","49422  >  https(443) [ACK] Seq=40 Ack=40 Win=62780 Len=0"
"8","2022-11-20 19:53:05.996006590","0.000065925","0.000000000","192.168.1.157","34.95.113.255","TLSv1.2","93","Application Data"
"9","2022-11-20 19:53:05.996397717","0.000391127","0.000391127","34.95.113.255","192.168.1.157","TCP","60","https(443)  >  52798 [ACK] Seq=1 Ack=40 Win=64240 Len=0"
"19","2022-11-20 19:53:05.999976935","0.001631542","0.003579218","34.95.113.255","192.168.1.157","TLSv1.2","93","Application Data"
"20","2022-11-20 19:53:06.041249245","0.041272310","0.041272310","192.168.1.157","34.95.113.255","TCP","54","52798  >  https(443) [ACK] Seq=40 Ack=40 Win=62780 Len=0"
"31","2022-11-20 19:53:06.109106655","0.058742561","0.000000000","192.168.1.157","192.168.1.161","TCP","66","35312  >  esmagent(5601) [ACK] Seq=1 Ack=1 Win=763 Len=0 TSval=4056213341 TSecr=1379274643"
"32","2022-11-20 19:53:06.109389536","0.000282881","0.000282881","192.168.1.161","192.168.1.157","TCP","66","[TCP ACKed unseen segment] esmagent(5601)  >  35312 [ACK] Seq=1 Ack=2 Win=501 Len=0 TSval=1379284882 TSecr=4056192962"
"188","2022-11-20 19:53:09.496589637","0.141513688","0.000000000","192.168.1.157","142.251.32.99","TCP","54","51858  >  http(80) [ACK] Seq=1 Ack=1 Win=63527 Len=0"
"223","2022-11-20 19:53:10.520522514","0.319234487","1.023932877","192.168.1.157","142.251.32.99","TCP","54","[TCP Dup ACK 188#1] 51858  >  http(80) [ACK] Seq=1 Ack=1 Win=63527 Len=0"
"224","2022-11-20 19:53:10.521067619","0.000545105","0.000545105","142.251.32.99","192.168.1.157","TCP","60","http(80)  >  51858 [ACK] Seq=1 Ack=2 Win=64240 Len=0"
"231","2022-11-20 19:53:11.997976718","0.773043620","5.888587182","192.168.1.157","192.168.1.161","HTTP/JSON","1707","[TCP Previous segment not captured] POST /api/ui_counters/_report HTTP/1.1 , JavaScript Object Notation (application/json)"
"232","2022-11-20 19:53:11.998429041","0.000452323","0.000452323","192.168.1.161","192.168.1.157","TCP","66","esmagent(5601)  >  35312 [ACK] Seq=1 Ack=1643 Win=501 Len=0 TSval=1379290765 TSecr=4056219230"
"259","2022-11-20 19:53:12.848617559","0.517706180","0.850188518","192.168.1.161","192.168.1.157","HTTP/JSON","493","HTTP/1.1 200 OK , JavaScript Object Notation (application/json)"
"260","2022-11-20 19:53:12.848638183","0.000020624","0.000020624","192.168.1.157","192.168.1.161","TCP","66","35312  >  esmagent(5601) [ACK] Seq=1643 Ack=428 Win=786 Len=0 TSval=4056220080 TSecr=1379291614"
"283","2022-11-20 19:53:13.119420802","0.068173463","0.270782619","192.168.1.157","192.168.1.161","HTTP","416","GET /app/home HTTP/1.1 "
"284","2022-11-20 19:53:13.143853721","0.024432919","0.024432919","192.168.1.161","192.168.1.157","TCP","658","[TCP ACKed unseen segment] esmagent(5601)  >  35312 [PSH, ACK] Seq=428 Ack=1993 Win=501 Len=592 TSval=1379291909 TSecr=4056220351 [TCP segment of a reassembled PDU]"
"285","2022-11-20 19:53:13.143879692","0.000025971","0.000025971","192.168.1.157","192.168.1.161","TCP","66","35312  >  esmagent(5601) [ACK] Seq=1993 Ack=1020 Win=808 Len=0 TSval=4056220376 TSecr=1379291909"
"286","2022-11-20 19:53:13.144771546","0.000891854","0.000891854","192.168.1.161","192.168.1.157","TCP","5858","[TCP ACKed unseen segment] esmagent(5601)  >  35312 [PSH, ACK] Seq=1020 Ack=1993 Win=501 Len=5792 TSval=1379291910 TSecr=4056220376 [TCP segment of a reassembled PDU]"
"287","2022-11-20 19:53:13.144771626","0.000000080","0.000000080","192.168.1.161","192.168.1.157","TCP","1514","esmagent(5601)  >  35312 [ACK] Seq=6812 Ack=1993 Win=501 Len=1448 TSval=1379291910 TSecr=4056220376 [TCP segment of a reassembled PDU]"
"288","2022-11-20 19:53:13.144794554","0.000022928","0.000022928","192.168.1.157","192.168.1.161","TCP","66","35312  >  esmagent(5601) [ACK] Seq=1993 Ack=6812 Win=899 Len=0 TSval=4056220376 TSecr=1379291910"
"289","2022-11-20 19:53:13.144815278","0.000020724","0.000020724","192.168.1.157","192.168.1.161","TCP","66","35312  >  esmagent(5601) [ACK] Seq=1993 Ack=8260 Win=921 Len=0 TSval=4056220376 TSecr=1379291910"
"290","2022-11-20 19:53:13.144878963","0.000063685","0.000063685","192.168.1.161","192.168.1.157","TCP","4410","[TCP ACKed unseen segment] esmagent(5601)  >  35312 [PSH, ACK] Seq=8260 Ack=1993 Win=501 Len=4344 TSval=1379291910 TSecr=4056220376 [TCP segment of a reassembled PDU]"
"291","2022-11-20 19:53:13.144878993","0.000000030","0.000000030","192.168.1.161","192.168.1.157","TCP","2962","esmagent(5601)  >  35312 [PSH, ACK] Seq=12604 Ack=1993 Win=501 Len=2896 TSval=1379291910 TSecr=4056220376 [TCP segment of a reassembled PDU]"
"292","2022-11-20 19:53:13.144881877","0.000002884","0.000002884","192.168.1.157","192.168.1.161","TCP","66","35312  >  esmagent(5601) [ACK] Seq=1993 Ack=12604 Win=989 Len=0 TSval=4056220377 TSecr=1379291910"
"293","2022-11-20 19:53:13.144903683","0.000021806","0.000021806","192.168.1.157","192.168.1.161","TCP","66","35312  >  esmagent(5601) [ACK] Seq=1993 Ack=15500 Win=1035 Len=0 TSval=4056220377 TSecr=1379291910"
"294","2022-11-20 19:53:13.145143336","0.000239653","0.000239653","192.168.1.161","192.168.1.157","TCP","1968","[TCP ACKed unseen segment] esmagent(5601)  >  35312 [PSH, ACK] Seq=15500 Ack=1993 Win=501 Len=1902 TSval=1379291910 TSecr=4056220376 [TCP segment of a reassembled PDU]"
"295","2022-11-20 19:53:13.145146109","0.000002773","0.000002773","192.168.1.157","192.168.1.161","TCP","66","35312  >  esmagent(5601) [ACK] Seq=1993 Ack=17402 Win=1064 Len=0 TSval=4056220377 TSecr=1379291910"
"296","2022-11-20 19:53:13.145215481","0.000069372","0.000069372","192.168.1.161","192.168.1.157","TCP","7306","[TCP ACKed unseen segment] esmagent(5601)  >  35312 [PSH, ACK] Seq=17402 Ack=1993 Win=501 Len=7240 TSval=1379291911 TSecr=4056220376 [TCP segment of a reassembled PDU]"
"297","2022-11-20 19:53:13.145217934","0.000002453","0.000002453","192.168.1.157","192.168.1.161","TCP","66","35312  >  esmagent(5601) [ACK] Seq=1993 Ack=24642 Win=1177 Len=0 TSval=4056220377 TSecr=1379291911"
"298","2022-11-20 19:53:13.145484049","0.000266115","0.000266115","192.168.1.161","192.168.1.157","TCP","1152","[TCP ACKed unseen segment] esmagent(5601)  >  35312 [PSH, ACK] Seq=24642 Ack=1993 Win=501 Len=1086 TSval=1379291911 TSecr=4056220377 [TCP segment of a reassembled PDU]"
"299","2022-11-20 19:53:13.145486572","0.000002523","0.000002523","192.168.1.157","192.168.1.161","TCP","66","35312  >  esmagent(5601) [ACK] Seq=1993 Ack=25728 Win=1200 Len=0 TSval=4056220377 TSecr=1379291911"
"300","2022-11-20 19:53:13.145743175","0.000256603","0.000256603","192.168.1.161","192.168.1.157","HTTP","71","[TCP ACKed unseen segment] HTTP/1.1 200 OK  (text/html)"
"301","2022-11-20 19:53:13.145745648","0.000002473","0.000002473","192.168.1.157","192.168.1.161","TCP","66","35312  >  esmagent(5601) [ACK] Seq=1993 Ack=25733 Win=1200 Len=0 TSval=4056220377 TSecr=1379291911"
"302","2022-11-20 19:53:13.193190644","0.047444996","0.047444996","192.168.1.157","192.168.1.161","HTTP","417","GET /bootstrap.js HTTP/1.1 "
"303","2022-11-20 19:53:13.200285702","0.007095058","0.007095058","192.168.1.161","192.168.1.157","HTTP","523","[TCP ACKed unseen segment] HTTP/1.1 304 Not Modified "
"304","2022-11-20 19:53:13.200301881","0.000016179","0.000016179","192.168.1.157","192.168.1.161","TCP","66","35312  >  esmagent(5601) [ACK] Seq=2344 Ack=26190 Win=1223 Len=0 TSval=4056220432 TSecr=1379291966"
"305","2022-11-20 19:53:13.382826636","0.182524755","0.182524755","192.168.1.157","192.168.1.161","HTTP","386","GET /ui/favicons/favicon.svg HTTP/1.1 "
"306","2022-11-20 19:53:13.383051942","0.000225306","0.000225306","192.168.1.157","192.168.1.161","TCP","66","35312  >  esmagent(5601) [FIN, ACK] Seq=2664 Ack=26190 Win=1223 Len=0 TSval=4056220615 TSecr=1379291966"
"307","2022-11-20 19:53:13.388085534","0.005033592","0.005033592","192.168.1.161","192.168.1.157","TCP","66","[TCP ACKed unseen segment] esmagent(5601)  >  35312 [FIN, ACK] Seq=26190 Ack=2665 Win=501 Len=0 TSval=1379292153 TSecr=4056220614"
"308","2022-11-20 19:53:13.388146456","0.000060922","0.000060922","192.168.1.157","192.168.1.161","TCP","66","35312  >  esmagent(5601) [ACK] Seq=2665 Ack=26191 Win=1223 Len=0 TSval=4056220620 TSecr=1379292153"
"309","2022-11-20 19:53:13.891310132","0.503163676","0.000000000","192.168.1.157","192.168.1.161","TCP","74","42620  >  esmagent(5601) [SYN] Seq=0 Win=64240 Len=0 MSS=1460 SACK_PERM TSval=4056221123 TSecr=0 WS=128"
"310","2022-11-20 19:53:13.891688069","0.000377937","0.000377937","192.168.1.161","192.168.1.157","TCP","74","esmagent(5601)  >  42620 [SYN, ACK] Seq=0 Ack=1 Win=65160 Len=0 MSS=1460 SACK_PERM TSval=1379292656 TSecr=4056221123 WS=128"
"311","2022-11-20 19:53:13.891706641","0.000018572","0.000018572","192.168.1.157","192.168.1.161","TCP","66","42620  >  esmagent(5601) [ACK] Seq=1 Ack=1 Win=64256 Len=0 TSval=4056221123 TSecr=1379292656"
"312","2022-11-20 19:53:13.891826572","0.000119931","0.000119931","192.168.1.157","192.168.1.161","HTTP","420","GET /translations/en.json HTTP/1.1 "
"313","2022-11-20 19:53:13.892191854","0.000365282","0.000365282","192.168.1.161","192.168.1.157","TCP","66","esmagent(5601)  >  42620 [ACK] Seq=1 Ack=355 Win=64896 Len=0 TSval=1379292657 TSecr=4056221123"
"314","2022-11-20 19:53:13.895797166","0.003605312","0.003605312","192.168.1.161","192.168.1.157","HTTP","517","HTTP/1.1 304 Not Modified "
"315","2022-11-20 19:53:13.895804415","0.000007249","0.000007249","192.168.1.157","192.168.1.161","TCP","66","42620  >  esmagent(5601) [ACK] Seq=355 Ack=452 Win=64128 Len=0 TSval=4056221127 TSecr=1379292660"
"316","2022-11-20 19:53:14.112510884","0.216706469","0.216706469","192.168.1.157","192.168.1.161","HTTP","493","GET /internal/security/me HTTP/1.1 "
"317","2022-11-20 19:53:14.115348288","0.002837404","0.002837404","192.168.1.161","192.168.1.157","HTTP","430","HTTP/1.1 200 OK "
"318","2022-11-20 19:53:14.115374901","0.000026613","0.000026613","192.168.1.157","192.168.1.161","TCP","66","42620  >  esmagent(5601) [ACK] Seq=782 Ack=816 Win=64128 Len=0 TSval=4056221347 TSecr=1379292879"
"319","2022-11-20 19:53:14.121987442","0.006612541","0.006612541","192.168.1.157","192.168.1.161","HTTP/JSON","1161","POST /api/core/capabilities HTTP/1.1 , JavaScript Object Notation (application/json)"
"320","2022-11-20 19:53:14.149797376","0.027809934","0.027809934","192.168.1.161","192.168.1.157","TCP","548","esmagent(5601)  >  42620 [PSH, ACK] Seq=816 Ack=1877 Win=64128 Len=482 TSval=1379292914 TSecr=4056221354 [TCP segment of a reassembled PDU]"
"321","2022-11-20 19:53:14.192348523","0.042551147","0.042551147","192.168.1.157","192.168.1.161","TCP","66","42620  >  esmagent(5601) [ACK] Seq=1877 Ack=1298 Win=64128 Len=0 TSval=4056221424 TSecr=1379292914"
"322","2022-11-20 19:53:14.192770856","0.000422333","0.000422333","192.168.1.161","192.168.1.157","HTTP/JSON","1445","HTTP/1.1 200 OK , JavaScript Object Notation (application/json)"
"323","2022-11-20 19:53:14.192779036","0.000008180","0.000008180","192.168.1.157","192.168.1.161","TCP","66","42620  >  esmagent(5601) [ACK] Seq=1877 Ack=2677 Win=64128 Len=0 TSval=4056221424 TSecr=1379292957"
"324","2022-11-20 19:53:14.350030645","0.157251609","0.157251609","192.168.1.157","192.168.1.161","HTTP/JSON","851","POST /internal/licensing/feature_usage/register HTTP/1.1 , JavaScript Object Notation (application/json)"
"325","2022-11-20 19:53:14.351131081","0.001100436","0.000000000","192.168.1.157","192.168.1.161","TCP","74","42624  >  esmagent(5601) [SYN] Seq=0 Win=64240 Len=0 MSS=1460 SACK_PERM TSval=4056221583 TSecr=0 WS=128"
"326","2022-11-20 19:53:14.351575811","0.000444730","0.000444730","192.168.1.161","192.168.1.157","TCP","74","esmagent(5601)  >  42624 [SYN, ACK] Seq=0 Ack=1 Win=65160 Len=0 MSS=1460 SACK_PERM TSval=1379293115 TSecr=4056221583 WS=128"
"327","2022-11-20 19:53:14.351590589","0.000014778","0.000014778","192.168.1.157","192.168.1.161","TCP","66","42624  >  esmagent(5601) [ACK] Seq=1 Ack=1 Win=64256 Len=0 TSval=4056221583 TSecr=1379293115"
"328","2022-11-20 19:53:14.351667703","0.000077114","0.000000000","192.168.1.157","192.168.1.161","TCP","74","42628  >  esmagent(5601) [SYN] Seq=0 Win=64240 Len=0 MSS=1460 SACK_PERM TSval=4056221583 TSecr=0 WS=128"
"329","2022-11-20 19:53:14.351727976","0.000060273","0.000137387","192.168.1.157","192.168.1.161","HTTP","517","GET /api/licensing/info HTTP/1.1 "
"330","2022-11-20 19:53:14.351858575","0.000130599","0.000000000","192.168.1.157","192.168.1.161","TCP","74","42638  >  esmagent(5601) [SYN] Seq=0 Win=64240 Len=0 MSS=1460 SACK_PERM TSval=4056221584 TSecr=0 WS=128"
"331","2022-11-20 19:53:14.352024036","0.000165461","0.000356333","192.168.1.161","192.168.1.157","TCP","74","esmagent(5601)  >  42628 [SYN, ACK] Seq=0 Ack=1 Win=65160 Len=0 MSS=1460 SACK_PERM TSval=1379293116 TSecr=4056221583 WS=128"
"332","2022-11-20 19:53:14.352050908","0.000026872","0.000026872","192.168.1.157","192.168.1.161","TCP","66","42628  >  esmagent(5601) [ACK] Seq=1 Ack=1 Win=64256 Len=0 TSval=4056221584 TSecr=1379293116"
"333","2022-11-20 19:53:14.352117980","0.000067072","0.000067072","192.168.1.157","192.168.1.161","HTTP","489","GET /api/banners/info HTTP/1.1 "
"334","2022-11-20 19:53:14.352223258","0.000105278","0.000495282","192.168.1.161","192.168.1.157","TCP","66","esmagent(5601)  >  42624 [ACK] Seq=1 Ack=452 Win=64768 Len=0 TSval=1379293116 TSecr=4056221583"
"335","2022-11-20 19:53:14.352495188","0.000271930","0.000000000","192.168.1.157","192.168.1.161","TCP","74","42640  >  esmagent(5601) [SYN] Seq=0 Win=64240 Len=0 MSS=1460 SACK_PERM TSval=4056221584 TSecr=0 WS=128"
"336","2022-11-20 19:53:14.352607785","0.000112597","0.000749210","192.168.1.161","192.168.1.157","TCP","74","esmagent(5601)  >  42638 [SYN, ACK] Seq=0 Ack=1 Win=65160 Len=0 MSS=1460 SACK_PERM TSval=1379293116 TSecr=4056221584 WS=128"
"337","2022-11-20 19:53:14.352607825","0.000000040","0.000489845","192.168.1.161","192.168.1.157","TCP","66","esmagent(5601)  >  42628 [ACK] Seq=1 Ack=424 Win=64768 Len=0 TSval=1379293116 TSecr=4056221584"
"338","2022-11-20 19:53:14.352636990","0.000029165","0.000029205","192.168.1.157","192.168.1.161","TCP","66","42638  >  esmagent(5601) [ACK] Seq=1 Ack=1 Win=64256 Len=0 TSval=4056221584 TSecr=1379293116"
"339","2022-11-20 19:53:14.352732111","0.000095121","0.000095121","192.168.1.157","192.168.1.161","HTTP","524","GET /internal/security/session HTTP/1.1 "
"340","2022-11-20 19:53:14.352819242","0.000087131","0.000324054","192.168.1.161","192.168.1.157","TCP","74","esmagent(5601)  >  42640 [SYN, ACK] Seq=0 Ack=1 Win=65160 Len=0 MSS=1460 SACK_PERM TSval=1379293117 TSecr=4056221584 WS=128"
"341","2022-11-20 19:53:14.352844502","0.000025260","0.000025260","192.168.1.157","192.168.1.161","TCP","66","42640  >  esmagent(5601) [ACK] Seq=1 Ack=1 Win=64256 Len=0 TSval=4056221584 TSecr=1379293117"
"342","2022-11-20 19:53:14.352959422","0.000114920","0.000114920","192.168.1.157","192.168.1.161","HTTP","513","GET /internal/security/security_checkup/state HTTP/1.1 "
"343","2022-11-20 19:53:14.353015460","0.000056038","0.000283349","192.168.1.161","192.168.1.157","TCP","66","esmagent(5601)  >  42638 [ACK] Seq=1 Ack=459 Win=64768 Len=0 TSval=1379293117 TSecr=4056221584"
"344","2022-11-20 19:53:14.353070717","0.000055257","0.000000000","192.168.1.157","192.168.1.161","TCP","74","42650  >  esmagent(5601) [SYN] Seq=0 Win=64240 Len=0 MSS=1460 SACK_PERM TSval=4056221585 TSecr=0 WS=128"
"345","2022-11-20 19:53:14.353270520","0.000199803","0.000311098","192.168.1.161","192.168.1.157","TCP","66","esmagent(5601)  >  42640 [ACK] Seq=1 Ack=448 Win=64768 Len=0 TSval=1379293117 TSecr=4056221585"
"346","2022-11-20 19:53:14.353601211","0.000330691","0.000530494","192.168.1.161","192.168.1.157","TCP","74","esmagent(5601)  >  42650 [SYN, ACK] Seq=0 Ack=1 Win=65160 Len=0 MSS=1460 SACK_PERM TSval=1379293117 TSecr=4056221585 WS=128"
"347","2022-11-20 19:53:14.353627463","0.000026252","0.000026252","192.168.1.157","192.168.1.161","TCP","66","42650  >  esmagent(5601) [ACK] Seq=1 Ack=1 Win=64256 Len=0 TSval=4056221585 TSecr=1379293117"
"348","2022-11-20 19:53:14.353760225","0.000132762","0.000132762","192.168.1.157","192.168.1.161","HTTP","519","GET /internal/security/me HTTP/1.1 "
"349","2022-11-20 19:53:14.353974635","0.000214410","0.000214410","192.168.1.161","192.168.1.157","TCP","66","esmagent(5601)  >  42650 [ACK] Seq=1 Ack=454 Win=64768 Len=0 TSval=1379293118 TSecr=4056221585"
"350","2022-11-20 19:53:14.354424632","0.000449997","0.004393987","192.168.1.161","192.168.1.157","HTTP/JSON","494","HTTP/1.1 200 OK , JavaScript Object Notation (application/json)"
"351","2022-11-20 19:53:14.354431240","0.000006608","0.000006608","192.168.1.157","192.168.1.161","TCP","66","42620  >  esmagent(5601) [ACK] Seq=2662 Ack=3105 Win=64128 Len=0 TSval=4056221586 TSecr=1379293118"
"352","2022-11-20 19:53:14.355451349","0.001020109","0.001020109","192.168.1.157","192.168.1.161","HTTP","529","GET /api/saved_objects_tagging/tags HTTP/1.1 "
"362","2022-11-20 19:53:14.370391123","0.000179784","0.017375663","192.168.1.161","192.168.1.157","HTTP","419","HTTP/1.1 204 No Content "
"363","2022-11-20 19:53:14.370402356","0.000011233","0.000011233","192.168.1.157","192.168.1.161","TCP","66","42638  >  esmagent(5601) [ACK] Seq=459 Ack=354 Win=64128 Len=0 TSval=4056221602 TSecr=1379293134"
"364","2022-11-20 19:53:14.370984603","0.000582247","0.000582247","192.168.1.157","192.168.1.161","HTTP/JSON","595","POST /api/saved_objects/_bulk_get HTTP/1.1 , JavaScript Object Notation (application/json)"
"367","2022-11-20 19:53:14.374877751","0.000490866","0.020903116","192.168.1.161","192.168.1.157","HTTP","430","HTTP/1.1 200 OK "
"368","2022-11-20 19:53:14.374891938","0.000014187","0.000014187","192.168.1.157","192.168.1.161","TCP","66","42650  >  esmagent(5601) [ACK] Seq=454 Ack=365 Win=64128 Len=0 TSval=4056221607 TSecr=1379293139"
"371","2022-11-20 19:53:14.379441144","0.000096497","9.326878488","192.168.1.157","34.120.127.120","TLSv1.2","93","Application Data"
"372","2022-11-20 19:53:14.380170760","0.000729616","0.000729616","34.120.127.120","192.168.1.157","TCP","60","https(443)  >  49422 [ACK] Seq=40 Ack=79 Win=64240 Len=0"
"373","2022-11-20 19:53:14.381836103","0.001665343","0.001665343","192.168.1.157","34.120.127.120","TLSv1.2","78","Application Data"
"374","2022-11-20 19:53:14.381877843","0.000041740","0.000041740","192.168.1.157","34.120.127.120","TCP","54","49422  >  https(443) [FIN, ACK] Seq=103 Ack=40 Win=62780 Len=0"
"375","2022-11-20 19:53:14.382481607","0.000603764","0.000603764","34.120.127.120","192.168.1.157","TCP","60","https(443)  >  49422 [ACK] Seq=40 Ack=103 Win=64240 Len=0"
"376","2022-11-20 19:53:14.382698521","0.000216914","0.000216914","34.120.127.120","192.168.1.157","TCP","60","https(443)  >  49422 [ACK] Seq=40 Ack=104 Win=64239 Len=0"
"379","2022-11-20 19:53:14.384683591","0.000422553","0.032460333","192.168.1.161","192.168.1.157","TCP","548","esmagent(5601)  >  42624 [PSH, ACK] Seq=1 Ack=452 Win=64768 Len=482 TSval=1379293148 TSecr=4056221583 [TCP segment of a reassembled PDU]"
"380","2022-11-20 19:53:14.384694044","0.000010453","0.000010453","192.168.1.157","192.168.1.161","TCP","66","42624  >  esmagent(5601) [ACK] Seq=452 Ack=483 Win=64128 Len=0 TSval=4056221616 TSecr=1379293148"
"382","2022-11-20 19:53:14.389901798","0.004853844","0.037293973","192.168.1.161","192.168.1.157","HTTP/JSON","618","HTTP/1.1 200 OK , JavaScript Object Notation (application/json)"
"383","2022-11-20 19:53:14.389922112","0.000020314","0.000020314","192.168.1.157","192.168.1.161","TCP","66","42628  >  esmagent(5601) [ACK] Seq=424 Ack=553 Win=64128 Len=0 TSval=4056221622 TSecr=1379293154"
"384","2022-11-20 19:53:14.390403137","0.000481025","0.005709093","192.168.1.161","192.168.1.157","TCP","466","esmagent(5601)  >  42624 [PSH, ACK] Seq=483 Ack=452 Win=64768 Len=400 TSval=1379293154 TSecr=4056221616 [TCP segment of a reassembled PDU]"
"385","2022-11-20 19:53:14.390410586","0.000007449","0.000007449","192.168.1.157","192.168.1.161","TCP","66","42624  >  esmagent(5601) [ACK] Seq=452 Ack=883 Win=64128 Len=0 TSval=4056221622 TSecr=1379293154"
"386","2022-11-20 19:53:14.390730254","0.000319668","0.000319668","192.168.1.161","192.168.1.157","HTTP/JSON","71","HTTP/1.1 200 OK , JavaScript Object Notation (application/json)"
"387","2022-11-20 19:53:14.390737533","0.000007279","0.000007279","192.168.1.157","192.168.1.161","TCP","66","42624  >  esmagent(5601) [ACK] Seq=452 Ack=888 Win=64128 Len=0 TSval=4056221622 TSecr=1379293155"
"388","2022-11-20 19:53:14.391579816","0.000842283","0.038309296","192.168.1.161","192.168.1.157","HTTP/JSON","522","HTTP/1.1 200 OK , JavaScript Object Notation (application/json)"
"389","2022-11-20 19:53:14.391587015","0.000007199","0.000007199","192.168.1.157","192.168.1.161","TCP","66","42640  >  esmagent(5601) [ACK] Seq=448 Ack=457 Win=64128 Len=0 TSval=4056221623 TSecr=1379293155"
"390","2022-11-20 19:53:14.392492164","0.000905149","0.021507561","192.168.1.161","192.168.1.157","HTTP/JSON","756","HTTP/1.1 200 OK , JavaScript Object Notation (application/json)"
"391","2022-11-20 19:53:14.396279294","0.003787130","0.013580773","34.120.127.120","192.168.1.157","TCP","60","https(443)  >  49422 [FIN, PSH, ACK] Seq=40 Ack=104 Win=64239 Len=0"
"392","2022-11-20 19:53:14.396297206","0.000017912","0.000017912","192.168.1.157","34.120.127.120","TCP","54","49422  >  https(443) [ACK] Seq=104 Ack=41 Win=62780 Len=0"
"393","2022-11-20 19:53:14.397224982","0.000927776","0.041773633","192.168.1.161","192.168.1.157","TCP","66","esmagent(5601)  >  42620 [ACK] Seq=3105 Ack=3125 Win=64128 Len=0 TSval=1379293161 TSecr=4056221587"
"394","2022-11-20 19:53:14.398072616","0.000847634","0.000847634","192.168.1.161","192.168.1.157","HTTP/JSON","655","HTTP/1.1 200 OK , JavaScript Object Notation (application/json)"
"395","2022-11-20 19:53:14.407166316","0.009093700","0.009093700","192.168.1.157","192.168.1.161","HTTP","519","GET /internal/security/me HTTP/1.1 "
"396","2022-11-20 19:53:14.407483811","0.000317495","0.000317495","192.168.1.161","192.168.1.157","TCP","66","esmagent(5601)  >  42620 [ACK] Seq=3694 Ack=3578 Win=64128 Len=0 TSval=1379293171 TSecr=4056221639"
"398","2022-11-20 19:53:14.409831503","0.000583189","0.002347692","192.168.1.161","192.168.1.157","HTTP","430","HTTP/1.1 200 OK "
"399","2022-11-20 19:53:14.436365957","0.026534454","0.043873793","192.168.1.157","192.168.1.161","TCP","66","42638  >  esmagent(5601) [ACK] Seq=988 Ack=1044 Win=64128 Len=0 TSval=4056221668 TSecr=1379293156"
"400","2022-11-20 19:53:14.452626396","0.016260439","0.042794893","192.168.1.157","192.168.1.161","TCP","66","42620  >  esmagent(5601) [ACK] Seq=3578 Ack=4058 Win=64128 Len=0 TSval=4056221684 TSecr=1379293174"
"401","2022-11-20 19:53:14.586990347","0.134363951","0.134363951","192.168.1.157","192.168.1.161","HTTP","514","GET /api/index_patterns/has_user_index_pattern HTTP/1.1 "
"402","2022-11-20 19:53:14.587566777","0.000576430","0.196829244","192.168.1.157","192.168.1.161","HTTP","502","GET /internal/spaces/_active_space HTTP/1.1 "
"403","2022-11-20 19:53:14.598005474","0.010438697","0.010438697","192.168.1.161","192.168.1.157","HTTP/JSON","635","HTTP/1.1 200 OK , JavaScript Object Notation (application/json)"
"404","2022-11-20 19:53:14.598036001","0.000030527","0.000030527","192.168.1.157","192.168.1.161","TCP","66","42624  >  esmagent(5601) [ACK] Seq=888 Ack=1457 Win=64128 Len=0 TSval=4056221830 TSecr=1379293362"
"405","2022-11-20 19:53:14.600454940","0.002418939","0.013464593","192.168.1.161","192.168.1.157","HTTP/JSON","515","HTTP/1.1 200 OK , JavaScript Object Notation (application/json)"
"406","2022-11-20 19:53:14.600470088","0.000015148","0.000015148","192.168.1.157","192.168.1.161","TCP","66","42620  >  esmagent(5601) [ACK] Seq=4026 Ack=4507 Win=64128 Len=0 TSval=4056221832 TSecr=1379293364"
"412","2022-11-20 19:53:14.987594923","0.001125588","8.946345678","192.168.1.157","34.95.113.255","TLSv1.2","137","Application Data"
"413","2022-11-20 19:53:14.987950254","0.000355331","0.000355331","34.95.113.255","192.168.1.157","TCP","60","https(443)  >  52798 [ACK] Seq=40 Ack=123 Win=64240 Len=0"
"425","2022-11-20 19:53:15.039556920","0.036904361","0.051606666","34.95.113.255","192.168.1.157","TLSv1.2","177","Application Data"
"426","2022-11-20 19:53:15.039573060","0.000016140","0.000016140","192.168.1.157","34.95.113.255","TCP","54","52798  >  https(443) [ACK] Seq=123 Ack=163 Win=62780 Len=0"
"427","2022-11-20 19:53:15.039893819","0.000320759","0.000320759","192.168.1.157","34.95.113.255","TLSv1.2","93","Application Data"
"428","2022-11-20 19:53:15.040053558","0.000159739","0.000159739","192.168.1.157","34.95.113.255","TLSv1.2","78","Application Data"
"429","2022-11-20 19:53:15.040127360","0.000073802","0.000073802","192.168.1.157","34.95.113.255","TCP","54","52798  >  https(443) [FIN, ACK] Seq=186 Ack=163 Win=62780 Len=0"
"430","2022-11-20 19:53:15.040263830","0.000136470","0.000136470","34.95.113.255","192.168.1.157","TCP","60","https(443)  >  52798 [ACK] Seq=163 Ack=162 Win=64240 Len=0"
"431","2022-11-20 19:53:15.040785990","0.000522160","0.000522160","34.95.113.255","192.168.1.157","TCP","60","https(443)  >  52798 [ACK] Seq=163 Ack=186 Win=64240 Len=0"
"432","2022-11-20 19:53:15.040786080","0.000000090","0.000000090","34.95.113.255","192.168.1.157","TCP","60","https(443)  >  52798 [ACK] Seq=163 Ack=187 Win=64239 Len=0"
"433","2022-11-20 19:53:15.047112203","0.006326123","0.006326123","34.95.113.255","192.168.1.157","TCP","60","https(443)  >  52798 [FIN, PSH, ACK] Seq=163 Ack=187 Win=64239 Len=0"
"434","2022-11-20 19:53:15.047121385","0.000009182","0.000009182","192.168.1.157","34.95.113.255","TCP","54","52798  >  https(443) [ACK] Seq=187 Ack=164 Win=62780 Len=0"
"505","2022-11-20 19:53:17.727461368","0.423959601","3.126991280","192.168.1.157","192.168.1.161","HTTP/JSON","607","POST /api/saved_objects/_bulk_get HTTP/1.1 , JavaScript Object Notation (application/json)"
"506","2022-11-20 19:53:17.733813003","0.006351635","0.006351635","192.168.1.161","192.168.1.157","HTTP/JSON","756","HTTP/1.1 200 OK , JavaScript Object Notation (application/json)"
"507","2022-11-20 19:53:17.733833870","0.000020867","0.000020867","192.168.1.157","192.168.1.161","TCP","66","42620  >  esmagent(5601) [ACK] Seq=4567 Ack=5197 Win=64128 Len=0 TSval=4056224965 TSecr=1379296493"
"508","2022-11-20 19:53:17.776242974","0.042409104","0.042409104","192.168.1.157","192.168.1.161","HTTP","600","GET /internal/data_views/has_data_views HTTP/1.1 "
"509","2022-11-20 19:53:17.790492839","0.014249865","0.014249865","192.168.1.161","192.168.1.157","HTTP/JSON","543","HTTP/1.1 200 OK , JavaScript Object Notation (application/json)"
"510","2022-11-20 19:53:17.790511694","0.000018855","0.000018855","192.168.1.157","192.168.1.161","TCP","66","42620  >  esmagent(5601) [ACK] Seq=5101 Ack=5674 Win=64128 Len=0 TSval=4056225022 TSecr=1379296550"
"511","2022-11-20 19:53:17.795740397","0.005228703","0.005228703","192.168.1.157","192.168.1.161","HTTP","615","GET /internal/index-pattern-management/resolve_index/* HTTP/1.1 "
"512","2022-11-20 19:53:17.803112266","0.007371869","0.007371869","192.168.1.161","192.168.1.157","HTTP/JSON","1241","HTTP/1.1 200 OK , JavaScript Object Notation (application/json)"
"513","2022-11-20 19:53:17.808986629","0.005874363","0.005874363","192.168.1.157","192.168.1.161","HTTP","676","GET /api/saved_objects/_find?fields=title&fields=type&fields=typeMeta&fields=name&per_page=10000&type=index-pattern HTTP/1.1 "
"514","2022-11-20 19:53:17.817375169","0.008388540","0.008388540","192.168.1.161","192.168.1.157","TCP","548","esmagent(5601)  >  42620 [PSH, ACK] Seq=6849 Ack=6260 Win=64128 Len=482 TSval=1379296577 TSecr=4056225041 [TCP segment of a reassembled PDU]"
"515","2022-11-20 19:53:17.860515725","0.043140556","0.043140556","192.168.1.157","192.168.1.161","TCP","66","42620  >  esmagent(5601) [ACK] Seq=6260 Ack=7331 Win=64128 Len=0 TSval=4056225092 TSecr=1379296577"
"516","2022-11-20 19:53:17.860856307","0.000340582","0.000340582","192.168.1.161","192.168.1.157","HTTP/JSON","507","HTTP/1.1 200 OK , JavaScript Object Notation (application/json)"
"517","2022-11-20 19:53:17.860865770","0.000009463","0.000009463","192.168.1.157","192.168.1.161","TCP","66","42620  >  esmagent(5601) [ACK] Seq=6260 Ack=7772 Win=64128 Len=0 TSval=4056225093 TSecr=1379296620"
"518","2022-11-20 19:53:17.966127000","0.105261230","0.105261230","192.168.1.157","192.168.1.161","HTTP/JSON","698","POST /api/saved_objects/_bulk_resolve HTTP/1.1 , JavaScript Object Notation (application/json)"
"519","2022-11-20 19:53:17.975542594","0.009415594","0.009415594","192.168.1.161","192.168.1.157","TCP","548","esmagent(5601)  >  42620 [PSH, ACK] Seq=7772 Ack=6892 Win=64128 Len=482 TSval=1379296735 TSecr=4056225198 [TCP segment of a reassembled PDU]"
"520","2022-11-20 19:53:17.975560567","0.000017973","0.000017973","192.168.1.157","192.168.1.161","TCP","66","42620  >  esmagent(5601) [ACK] Seq=6892 Ack=8254 Win=64128 Len=0 TSval=4056225207 TSecr=1379296735"
"521","2022-11-20 19:53:17.975895933","0.000335366","0.000335366","192.168.1.161","192.168.1.157","HTTP/JSON","941","HTTP/1.1 200 OK , JavaScript Object Notation (application/json)"
"522","2022-11-20 19:53:17.975900969","0.000005036","0.000005036","192.168.1.157","192.168.1.161","TCP","66","42620  >  esmagent(5601) [ACK] Seq=6892 Ack=9129 Win=64128 Len=0 TSval=4056225208 TSecr=1379296735"
"523","2022-11-20 19:53:17.980085067","0.004184098","0.004184098","192.168.1.157","192.168.1.161","HTTP","699","GET /api/index_patterns/_fields_for_wildcard?pattern=auditbeat-*&meta_fields=_source&meta_fields=_id&meta_fields=_index&meta_fields=_score HTTP/1.1 "
"539","2022-11-20 19:53:18.012789068","0.000522632","0.032704001","192.168.1.161","192.168.1.157","TCP","548","esmagent(5601)  >  42620 [PSH, ACK] Seq=9129 Ack=7525 Win=64128 Len=482 TSval=1379296772 TSecr=4056225212 [TCP segment of a reassembled PDU]"
"540","2022-11-20 19:53:18.013118755","0.000329687","0.000329687","192.168.1.161","192.168.1.157","TCP","2962","esmagent(5601)  >  42620 [PSH, ACK] Seq=9611 Ack=7525 Win=64128 Len=2896 TSval=1379296772 TSecr=4056225212 [TCP segment of a reassembled PDU]"
"541","2022-11-20 19:53:18.013185383","0.000066628","0.000066628","192.168.1.157","192.168.1.161","TCP","66","42620  >  esmagent(5601) [ACK] Seq=7525 Ack=12507 Win=64128 Len=0 TSval=4056225245 TSecr=1379296772"
"542","2022-11-20 19:53:18.013214231","0.000028848","0.000028848","192.168.1.161","192.168.1.157","TCP","2962","esmagent(5601)  >  42620 [PSH, ACK] Seq=12507 Ack=7525 Win=64128 Len=2896 TSval=1379296772 TSecr=4056225212 [TCP segment of a reassembled PDU]"
"543","2022-11-20 19:53:18.013224895","0.000010664","0.000010664","192.168.1.157","192.168.1.161","TCP","66","42620  >  esmagent(5601) [ACK] Seq=7525 Ack=15403 Win=64128 Len=0 TSval=4056225245 TSecr=1379296772"
"544","2022-11-20 19:53:18.013278466","0.000053571","0.000053571","192.168.1.161","192.168.1.157","TCP","2962","esmagent(5601)  >  42620 [PSH, ACK] Seq=15403 Ack=7525 Win=64128 Len=2896 TSval=1379296772 TSecr=4056225212 [TCP segment of a reassembled PDU]"
"545","2022-11-20 19:53:18.013342541","0.000064075","0.000064075","192.168.1.157","192.168.1.161","TCP","66","42620  >  esmagent(5601) [ACK] Seq=7525 Ack=18299 Win=64128 Len=0 TSval=4056225245 TSecr=1379296772"
"546","2022-11-20 19:53:18.013347067","0.000004526","0.000004526","192.168.1.161","192.168.1.157","TCP","1514","esmagent(5601)  >  42620 [ACK] Seq=18299 Ack=7525 Win=64128 Len=1448 TSval=1379296772 TSecr=4056225212 [TCP segment of a reassembled PDU]"
"547","2022-11-20 19:53:18.013667752","0.000320685","0.000320685","192.168.1.161","192.168.1.157","TCP","902","esmagent(5601)  >  42620 [PSH, ACK] Seq=19747 Ack=7525 Win=64128 Len=836 TSval=1379296773 TSecr=4056225245 [TCP segment of a reassembled PDU]"
"548","2022-11-20 19:53:18.013674471","0.000006719","0.000006719","192.168.1.157","192.168.1.161","TCP","66","42620  >  esmagent(5601) [ACK] Seq=7525 Ack=20583 Win=64128 Len=0 TSval=4056225245 TSecr=1379296772"
"549","2022-11-20 19:53:18.018550508","0.004876037","0.004876037","192.168.1.161","192.168.1.157","HTTP/JSON","71","HTTP/1.1 200 OK , JavaScript Object Notation (application/json)"
"557","2022-11-20 19:53:18.041992659","0.000167201","0.023442151","192.168.1.157","192.168.1.161","HTTP","720","GET /api/index_patterns/_fields_for_wildcard?pattern=auditbeat-*&meta_fields=_source&meta_fields=_id&meta_fields=_index&meta_fields=_score&allow_no_index=false HTTP/1.1 "
"568","2022-11-20 19:53:18.085871163","0.005911198","0.043878504","192.168.1.161","192.168.1.157","TCP","66","esmagent(5601)  >  42620 [ACK] Seq=20588 Ack=8179 Win=64128 Len=0 TSval=1379296845 TSecr=4056225274"
"569","2022-11-20 19:53:18.100260316","0.014389153","0.014389153","192.168.1.161","192.168.1.157","TCP","548","esmagent(5601)  >  42620 [PSH, ACK] Seq=20588 Ack=8179 Win=64128 Len=482 TSval=1379296859 TSecr=4056225274 [TCP segment of a reassembled PDU]"
"570","2022-11-20 19:53:18.101222891","0.000962575","0.000962575","192.168.1.161","192.168.1.157","TCP","4410","esmagent(5601)  >  42620 [PSH, ACK] Seq=21070 Ack=8179 Win=64128 Len=4344 TSval=1379296860 TSecr=4056225274 [TCP segment of a reassembled PDU]"
"571","2022-11-20 19:53:18.101299242","0.000076351","0.000076351","192.168.1.161","192.168.1.157","TCP","4410","esmagent(5601)  >  42620 [PSH, ACK] Seq=25414 Ack=8179 Win=64128 Len=4344 TSval=1379296860 TSecr=4056225274 [TCP segment of a reassembled PDU]"
"572","2022-11-20 19:53:18.101310437","0.000011195","0.000011195","192.168.1.157","192.168.1.161","TCP","66","42620  >  esmagent(5601) [ACK] Seq=8179 Ack=25414 Win=62592 Len=0 TSval=4056225333 TSecr=1379296859"
"573","2022-11-20 19:53:18.101350840","0.000040403","0.000040403","192.168.1.157","192.168.1.161","TCP","66","42620  >  esmagent(5601) [ACK] Seq=8179 Ack=29758 Win=64128 Len=0 TSval=4056225333 TSecr=1379296860"
"574","2022-11-20 19:53:18.101395139","0.000044299","0.000044299","192.168.1.161","192.168.1.157","TCP","1514","esmagent(5601)  >  42620 [ACK] Seq=29758 Ack=8179 Win=64128 Len=1448 TSval=1379296861 TSecr=4056225274 [TCP segment of a reassembled PDU]"
"575","2022-11-20 19:53:18.101692943","0.000297804","0.000297804","192.168.1.161","192.168.1.157","HTTP/JSON","907","HTTP/1.1 200 OK , JavaScript Object Notation (application/json)"
"576","2022-11-20 19:53:18.101698411","0.000005468","0.000005468","192.168.1.157","192.168.1.161","TCP","66","42620  >  esmagent(5601) [ACK] Seq=8179 Ack=32047 Win=64128 Len=0 TSval=4056225333 TSecr=1379296861"
"577","2022-11-20 19:53:18.144756689","0.043058278","0.043058278","192.168.1.157","192.168.1.161","HTTP","416","GET /55434/bundles/kbn-ui-shared-deps-npm/kbn-ui-shared-deps-npm.chunk.59.js HTTP/1.1 "
"578","2022-11-20 19:53:18.144964774","0.000208085","0.000208085","192.168.1.157","192.168.1.161","TCP","66","42620  >  esmagent(5601) [FIN, ACK] Seq=8529 Ack=32047 Win=64128 Len=0 TSval=4056225377 TSecr=1379296861"
"579","2022-11-20 19:53:18.145036399","0.000071625","3.547000398","192.168.1.157","192.168.1.161","HTTP","417","GET /55434/bundles/kbn-ui-shared-deps-npm/kbn-ui-shared-deps-npm.chunk.175.js HTTP/1.1 "
"580","2022-11-20 19:53:18.145291918","0.000255519","0.000327144","192.168.1.161","192.168.1.157","TCP","66","esmagent(5601)  >  42620 [ACK] Seq=32047 Ack=8529 Win=64128 Len=0 TSval=1379296904 TSecr=4056225376"
"581","2022-11-20 19:53:18.145860400","0.000568482","0.000824001","192.168.1.157","192.168.1.161","TCP","66","42624  >  esmagent(5601) [FIN, ACK] Seq=1239 Ack=1457 Win=64128 Len=0 TSval=4056225378 TSecr=1379293362"
"583","2022-11-20 19:53:18.146208631","0.000268906","3.709842674","192.168.1.157","192.168.1.161","HTTP","417","GET /55434/bundles/kbn-ui-shared-deps-npm/kbn-ui-shared-deps-npm.chunk.182.js HTTP/1.1 "
"584","2022-11-20 19:53:18.146669842","0.000461211","3.756747730","192.168.1.157","192.168.1.161","HTTP","417","GET /55434/bundles/kbn-ui-shared-deps-npm/kbn-ui-shared-deps-npm.chunk.277.js HTTP/1.1 "
"585","2022-11-20 19:53:18.146726677","0.000056835","0.000518046","192.168.1.157","192.168.1.161","TCP","66","42638  >  esmagent(5601) [FIN, ACK] Seq=1339 Ack=1044 Win=64128 Len=0 TSval=4056225378 TSecr=1379293156"
"586","2022-11-20 19:53:18.146931659","0.000204982","0.000261817","192.168.1.161","192.168.1.157","TCP","66","esmagent(5601)  >  42628 [ACK] Seq=553 Ack=775 Win=64512 Len=0 TSval=1379296906 TSecr=4056225378"
"587","2022-11-20 19:53:18.147328854","0.000397195","0.000397195","192.168.1.157","192.168.1.161","TCP","66","42628  >  esmagent(5601) [FIN, ACK] Seq=775 Ack=553 Win=64128 Len=0 TSval=4056225379 TSecr=1379296906"
"588","2022-11-20 19:53:18.151241646","0.003912792","0.005949728","192.168.1.161","192.168.1.157","TCP","66","esmagent(5601)  >  42620 [FIN, ACK] Seq=32047 Ack=8530 Win=64128 Len=0 TSval=1379296910 TSecr=4056225377"
"589","2022-11-20 19:53:18.151270444","0.000028798","0.000028798","192.168.1.157","192.168.1.161","TCP","66","42620  >  esmagent(5601) [ACK] Seq=8530 Ack=32048 Win=64128 Len=0 TSval=4056225383 TSecr=1379296910"
"590","2022-11-20 19:53:18.154226529","0.002956085","0.008366129","192.168.1.161","192.168.1.157","TCP","66","esmagent(5601)  >  42624 [FIN, ACK] Seq=1457 Ack=1240 Win=64128 Len=0 TSval=1379296913 TSecr=4056225377"
"591","2022-11-20 19:53:18.154226659","0.000000130","0.007499982","192.168.1.161","192.168.1.157","TCP","66","esmagent(5601)  >  42638 [FIN, ACK] Seq=1044 Ack=1340 Win=64128 Len=0 TSval=1379296913 TSecr=4056225378"
"592","2022-11-20 19:53:18.154241218","0.000014559","0.000014689","192.168.1.157","192.168.1.161","TCP","66","42624  >  esmagent(5601) [ACK] Seq=1240 Ack=1458 Win=64128 Len=0 TSval=4056225386 TSecr=1379296913"
"593","2022-11-20 19:53:18.154282583","0.000041365","0.000055924","192.168.1.157","192.168.1.161","TCP","66","42638  >  esmagent(5601) [ACK] Seq=1340 Ack=1045 Win=64128 Len=0 TSval=4056225386 TSecr=1379296913"
"594","2022-11-20 19:53:18.154470512","0.000187929","0.007141658","192.168.1.161","192.168.1.157","TCP","66","esmagent(5601)  >  42628 [FIN, ACK] Seq=553 Ack=776 Win=64512 Len=0 TSval=1379296913 TSecr=4056225379"
"595","2022-11-20 19:53:18.154475058","0.000004546","0.000004546","192.168.1.157","192.168.1.161","TCP","66","42628  >  esmagent(5601) [ACK] Seq=776 Ack=554 Win=64128 Len=0 TSval=4056225386 TSecr=1379296913"
"630","2022-11-20 19:53:18.247401870","0.006804250","3.855814855","192.168.1.157","192.168.1.161","HTTP","417","GET /55434/bundles/kbn-ui-shared-deps-npm/kbn-ui-shared-deps-npm.chunk.153.js HTTP/1.1 "
"631","2022-11-20 19:53:18.248137504","0.000735634","0.000735634","192.168.1.157","192.168.1.161","TCP","66","42640  >  esmagent(5601) [FIN, ACK] Seq=799 Ack=457 Win=64128 Len=0 TSval=4056225480 TSecr=1379293155"
"632","2022-11-20 19:53:18.249479280","0.001341776","0.001341776","192.168.1.161","192.168.1.157","TCP","66","esmagent(5601)  >  42640 [FIN, ACK] Seq=457 Ack=800 Win=64512 Len=0 TSval=1379297008 TSecr=4056225479"
"633","2022-11-20 19:53:18.249494210","0.000014930","0.000014930","192.168.1.157","192.168.1.161","TCP","66","42640  >  esmagent(5601) [ACK] Seq=800 Ack=458 Win=64128 Len=0 TSval=4056225481 TSecr=1379297008"
"635","2022-11-20 19:53:18.256630320","0.006494320","3.881738382","192.168.1.157","192.168.1.161","HTTP/JSON","678","POST /api/saved_query/_find HTTP/1.1 , JavaScript Object Notation (application/json)"
